{
  "schemaVersion": "1.0.0",
  "gameRoot": "",
  "profile": "v24pure",
  "outputDirectory": "",
  "maxRuntimeMs": 600000,
  "initialWaitTimeoutMs": 240000,
  "settleFrames": 3,
  "displaySettleFrames": 4,
  "displayBackend": "canvas",
  "captureScreenshot": true,
  "viewportWidth": 1280,
  "viewportHeight": 720,
  "maxDisplayBytes": 16777216,
  "traceEnabled": true,
  "maxTraceEvents": 1000000,
  "inputs": [
    {
      "value": "0",
      "fromButton": true,
      "skip": false,
      "mouseButton": 0,
      "waitTimeoutMs": 240000
    },
    {
      "value": "0",
      "fromButton": true,
      "skip": false,
      "mouseButton": 0,
      "waitTimeoutMs": 120000
    }
  ]
}
